<xs:schema attributeFormDefault="unqualified"
           elementFormDefault="qualified"
           xmlns:xs="http://www.w3.org/2001/XMLSchema"
           targetNamespace="com.intervals"
           xmlns="com.intervals">
    <xs:element name="intervals_data">
        <xs:complexType>
            <xs:sequence>
                <xs:element name="data">
                    <xs:complexType>
                        <xs:sequence>
                            <xs:element name="entry" maxOccurs="unbounded" minOccurs="0">
                                <xs:complexType>
                                    <xs:sequence>
                                        <xs:element type="xs:byte" name="id"/>
                                        <xs:element type="xs:string" name="name"/>
                                        <xs:element name="timezone" default="+00:00">
                                            <xs:simpleType>
                                                <xs:restriction base="xs:string">
                                                    <xs:pattern value="[+|-]+([0-1][0-3])[:]([0,3,4][0,5])"/>
                                                </xs:restriction>
                                            </xs:simpleType>
                                        </xs:element>
                                        <xs:element name="busy_time">
                                            <xs:complexType>
                                                <xs:sequence>
                                                    <xs:element name="entry" minOccurs="1" maxOccurs="unbounded">
                                                        <xs:complexType>
                                                            <xs:sequence>
                                                                <xs:element type="xs:date" name="date"/>
                                                                <xs:element ref="time_entries"/>
                                                            </xs:sequence>
                                                        </xs:complexType>
                                                    </xs:element>
                                                </xs:sequence>
                                            </xs:complexType>
                                        </xs:element>
                                    </xs:sequence>
                                </xs:complexType>
                            </xs:element>
                        </xs:sequence>
                    </xs:complexType>
                </xs:element>
            </xs:sequence>
        </xs:complexType>
    </xs:element>

    <xs:element name="time_entries">
        <xs:complexType>
            <xs:sequence>
                <xs:element name="entry" minOccurs="1" maxOccurs="5">
                    <xs:complexType>
                        <xs:sequence>
                            <xs:element type="xs:time" name="from"/>
                            <xs:element type="xs:time" name="to"/>
                        </xs:sequence>
                    </xs:complexType>
                </xs:element>
            </xs:sequence>
        </xs:complexType>
    </xs:element>
</xs:schema>